Date,Text,sentiment_score
2023-05-24,Meta conducts yet another round of layoffs  TechCrunch,-0.9038996696472168
2023-05-24,Top EU regulator defends mega $1.3 billion privacy fine on Meta: ‘I have to enforce the law’  CNBC,-0.655271053314209
2023-05-24,Meta’s business groups cut in latest round of layoffs  CNN,-0.9563120603561401
2023-05-24,"Meta has started its latest round of layoffs, focusing on business groups  CNBC",-0.777969241142273
2023-05-24,Meta just copped a A$1.9bn fine for keeping EU data in the US. But why should users care where data are stored?  The Conversation,-0.18926577270030975
2023-05-25,Revealed: the contentious tool US immigration uses to get your data from tech firms  The Guardian,-0.045661602169275284
2023-05-26,Tech layoffs ravage the teams that fight online misinformation and hate speech  CNBC,-0.768575131893158
2023-05-30,The Italian Antitrust Authority investigates Meta for abuse of economic dependence  Wolters Kluwer,-0.30211982131004333
2023-05-30,"5 charts on YouTube’s ad standing amid TikTok, Meta, and CTV competition  eMarketer",0.40732547640800476
2023-05-31,New Meta Avatar Outfits From Naomi Osaka  Meta Store,0.09100309014320374
2023-05-31,Meta threatens to pull news from its apps in California  Axios,-0.9164164662361145
2023-06-01,Meta Requires Office Workers to Return to Desks Three Days a Week  The Wall Street Journal,-0.2601652145385742
2023-06-03,"Meta, Twitter, and TikTok Emerge as America's Most Hated Brands  DesignRush",-0.7066549062728882
2023-06-05,Apple’s Vision Pro & Meta’s Vision Oh No | by M.G. Siegler  500ish,-0.021623099222779274
2023-06-06,"Hawley and Blumenthal Demand Answers from Meta, Warn of Misuse After 'Leak' of Meta's AI Model  U.S. Senate (.gov)",-0.9206299781799316
2023-06-06,The Influence of Political Advocacy NGOs on Meta’s Human Rights Content Moderation Process: Gaza 2021 Case Study  NGO Monitor,0.03909177705645561
2023-06-07,Meta and Catona Climate partner to scale nature-based carbon removal solutions  Trellis Group,0.3394356966018677
2023-06-09,Meta Employee Morale Is Low. Mark Zuckerberg Is Touting AI To Fix That.  Data Center Knowledge,-0.8744832277297974
2023-06-14,Facebook Parent Company Meta Uses Bible Translations to Train Artificial Intelligence in Speech Recognition  MinistryWatch,0.05249527096748352
2023-06-15,What We Learned From Meta’s and Alphabet’s 2023 Shareholder Meetings  Morningstar,0.035325922071933746
2023-06-15,Meta Pixel Helper: Key Features and How To Install  Shopify,0.03074152022600174
2023-06-15,The slow decline of Meta’s Trusted Partner program  Rest of World,-0.6602262854576111
2023-06-15,I Tried Hanging Out With My Son in VR for Father's Day  Lifehacker,-0.009434666484594345
2023-06-16,"FTC Chair Lina Khan refused to sit out agency's case against Meta despite ethics concerns, report says  CNBC",-0.4225673973560333
2023-06-16,Meta AI Chief: Current AI not at dog-level intelligence  AI Magazine,-0.03309042006731033
2023-06-16,Meta to Lower Age for Users of Virtual Reality Headset to 10 From 13 (Published 2023)  The New York Times,0.22034603357315063
2023-06-16,Meta is already backing off its future retail plans a year after opening its first physical store  Business Insider,-0.8125017881393433
2023-06-16,Meta is lowering the minimum age for the Quest to 10 years old  The Verge,-0.10293872654438019
2023-06-16,Meta lowers the minimum age for its Quest headsets from 13 to 10  CNN,-0.4925414025783539
2023-06-16,Introducing Voicebox: The Most Versatile AI for Speech Generation  Meta Store,0.2017602175474167
2023-06-16,Zuckerberg’s Metamate Foreshadows Huge AI Workplace Trend  observer.com,0.02082180231809616
2023-06-16,Meta's Voicebox AI is a Dall-E for text-to-speech  Engadget,0.011987458914518356
2023-06-16,Meta rolls back measures to tackle COVID misinformation  Reuters,0.5809234380722046
2023-06-16,Meta Reducing Quest 2 & 3 Minimum Age From 13 To 10 Years Old  UploadVR,0.16586212813854218
2023-06-16,Meta's $1.3B Fine Highlights Risks of EU-US Data Transfers  Buchanan Ingersoll & Rooney PC,-0.2933697998523712
2023-06-17,Mark Zuckerberg Was Early in AI. Now Meta Is Trying to Catch Up.  The Wall Street Journal,0.03946208953857422
2023-06-18,Meta lost a third of its AI researchers over the last year. Now it's struggling to keep up.  Business Insider,-0.9447198510169983
2023-06-18,Meta Trying to Stop the Taliban From Using WhatsApp for Official Business  Business Insider,-0.12013512849807739
2023-06-19,Health experts worry as Meta rolls back some COVID misinformation policies  ABC News,-0.8988943099975586
2023-06-19,Facebook helped bring free speech to Vietnam. Now it’s helping stifle it.  The Washington Post,0.05804859846830368
2023-06-20,"Inside Meta's AI sales pitch at Cannes—including chatbots, media buying and ad generation  Ad Age",0.06362605094909668
2023-06-20,Meta Launches ‘Human-Like’ AI Image Generation Model  PetaPixel,0.11027725785970688
2023-06-20,"Meta Announces Voicebox Generative AI Model, Touting Accessibility Implications  Forbes",0.1488824486732483
2023-06-20,How AI is Powering Marketing Success and Business Growth  Meta Store,0.04927276074886322
2023-06-20,Meta Debuts Generative AI Tools  XR Today,0.04638228565454483
2023-06-20,Meta’s AI leaders want you to know fears over AI existential risk are “ridiculous”  MIT Technology Review,-0.0044718049466609955
2023-06-20,"Meta announces new AI model that can replicate the voices of loved ones, but says it's too risky to release  Business Insider",0.050831280648708344
2023-06-21,An Iraqi historian was slain after being labeled a spy on Facebook. Exclusive emails show catastrophic delays in removing threatening posts.  Business Insider,-0.8143794536590576
2023-06-21,Vimala Meta Drews  Starks Funeral Parlor,-0.023812873288989067
2023-06-22,First Look: 2024 Commencal Meta V5  Pinkbike,0.02965916134417057
2023-06-22,Meta leaving its office space in Azrieli tower in Tel Aviv in apparent cutback move  CTech,-0.8914522528648376
2023-06-22,Bringing People Together to Inform Decision-Making on Generative AI  Meta Store,0.0730399340391159
2023-06-22,"Meta Stock Vs Tesla: In a Fight Between the Stocks, Which Is the Better Buy?  Morningstar Canada",-0.004408985376358032
2023-06-22,Scalar topological photonic nested meta-crystals and skyrmion surface states in the light cone continuum  Nature,0.0032285023480653763
2023-06-22,Meta pulls news content from Canadian Facebook and Instagram  Engadget,-0.003614051267504692
2023-06-22,Meta Platforms' return to growth index highlights annual Russell refresh  Reuters,0.0880315750837326
2023-06-22,Meta’s Oversight Board Recommends Major Advance in International Accountability  Tech Policy Press,0.7670467495918274
2023-06-22,Protecting Privacy in the Metaverse  Humboldt NOW,0.026869997382164
2023-06-22,Zuckerberg-Musk Cage Fight: Meta Boss Favorite In Proposed Bout Of Billionaires  Forbes,0.0354343056678772
2023-06-23,Meta amplifies Reels with new advertising features  eMarketer,0.07681586593389511
2023-06-23,Meta to Block Facebook and Instagram News Sharing in Canada  The Hollywood Reporter,-0.6346365213394165
2023-06-23,Meta's path to AR glasses is full of stumbling blocks  MIXED Reality News,-0.06288705766201019
2023-06-23,Malaysia to take legal action against Meta over ‘undesirable’ content  CNN,-0.8506667613983154
2023-06-23,Brands on Fire: Meta’s Global Experiential Lead on Cannes Lions SuperStudio Activation  Chief Marketer,0.19761598110198975
2023-06-24,Breakingviews - Tesla vs. Meta cage fight already has a winner  Reuters,0.13575735688209534
2023-06-26,People Are Using Meta’s New AI to Make Graphic Sexbots  Futurism,0.0403040274977684
2023-06-26,Meta launches VR subscription service that costs $7.99 a month  CNBC,0.05643801391124725
2023-06-27,"Meta Announces New Teen Safety Tools, Including Updated Parental Oversight and Messaging Controls  Social Media Today",0.1932416558265686
2023-06-27,Meta Recognizes Seyfarth as Third Among its Top Law Firms in 2023 Outside Counsel Diversity Champions Awards  Seyfarth Shaw LLP,0.4413510262966156
2023-06-27,Giving Teens and Parents More Ways to Manage Their Time on Our Apps  Meta Store,0.1360725462436676
2023-06-27,Meta is rolling out new parental control tools for Instagram and Messenger  TechCrunch,0.38568657636642456
2023-06-27,"Launching Our Feed Our Future, a Youth Advisory Network in Partnership with ThinkYoung  Meta Store",0.2149268388748169
2023-06-27,Meta developer tools: Working at scale  Engineering at Meta,0.031182147562503815
2023-06-27,"[STUDENT ESSAY] In the Age of Tech Giants, Is Meta on a Treacherous Path?  Sciences Po",-0.04530287906527519
2023-06-27,Meta: Facebook owner launches $7.99 a month virtual reality service  BBC,0.08861415088176727
2023-06-27,Meta Announces Coming Expansion of Meta Verified Program to All Regions  Social Media Today,0.7187591791152954
2023-06-27,Meta laid her off by surprise. Now she says she's better off—3 strategies she used to rebound  CNBC,0.09875703603029251
2023-06-27,Meta’s Data Practices Are in the Spotlight: Brands Should Pay Close Attention  Infosecurity Magazine,0.15836836397647858
2023-06-27,"Gettin’ Meta With It: Books About Books, Part 1  TulsaKids Magazine",-0.004084501415491104
2023-06-27,Why Meta Platforms Was Rising Today  The Motley Fool,0.20381541550159454
2023-06-29,Meta's Nick Clegg on how AI is reshaping the feed  Platformer,0.2048145830631256
2023-06-29,Meta Shares How AI Dictates Instagram and Facebook Feeds  tech.co,-0.04315219819545746
2023-06-29,How AI Influences What You See on Facebook and Instagram  Meta Store,-0.021188730373978615
2023-06-29,Meta explains the AI behind its social media algorithms  The Verge,-0.003484252840280533
2023-06-29,Meta explains how its AI decides what you see on Facebook and Instagram  Engadget,-0.0001893267035484314
2023-06-29,First Look: 2024 Commencal Meta SX V5  Pinkbike,0.03296220675110817
2023-06-29,Meta is planning to let people in the EU download apps through Facebook  The Verge,0.08923492580652237
2023-06-29,Meta releases clues on how AI is used on Facebook and Instagram  CNN,0.01193237118422985
2023-06-29,Meta's system cards show how AI powers content recommendations on Facebook and Instagram  SiliconANGLE,0.027769900858402252
2023-06-29,Meta really wants to explain its AI recommendation algorithms to you  TechCrunch,0.06524360179901123
2023-06-29,Meta’s Evenstar is transitioning to OCP to accelerate open RAN adoption  Engineering at Meta,0.36249077320098877
2023-06-29,"Meta Provides New Insight into its Evolving Feed Algorithms, and How its Using AI  Social Media Today",0.12330219149589539
2023-06-30,"Meta received over 450,000 government requests for user data in 2022  Bitdefender",0.08856406807899475
2023-06-30,Meta Oversight Board recommends 6 month suspension of Cambodia PM social media  Jurist.org,-0.5173426866531372
2023-07-03,Meta’s ‘Twitter Killer’ App Is Coming (Published 2023)  The New York Times,0.0353471115231514
2023-07-04,‘Huge blow for Meta’ as EU’s top court sinks legal basis for targeted advertising on Facebook  Fortune,-0.9115604758262634
2023-07-04,"Meta unveils Threads, new app to challenge Twitter  PBS",0.2830457091331482
2023-07-04,Cambodia bars Meta oversight board over PM's Facebook account suspension  Reuters,-0.8246366381645203
2023-07-05,Meta launches Instagram Threads in a direct challenge to Twitter  CNBC,0.011193983256816864
2023-07-05,"Meta gears up its Twitter challenger, Threads, as part of Instagram  Axios",0.07559285312891006
2023-07-05,"10 million sign up for Meta's Twitter rival app, Threads  NPR",0.08982259035110474
2023-07-05,Meta Stock Soars To 18-Month High Ahead Of Instagram Threads Launch  Forbes,0.8064670562744141
2023-07-05,The FTC’s Proposed Sanctions Against Meta Represent Regulatory Overreach  Center for Data Innovation,-0.5360717177391052
2023-07-05,Meta’s Threads app is here to challenge Twitter  Engadget,0.2724718153476715
2023-07-05,Introducing Threads: A New Way to Share With Text  Meta Store,0.1270596832036972
2023-07-06,Twitter accuses Meta of stealing trade secrets for its new Threads app  CNBC,-0.7822451591491699
2023-07-06,Meta officially launches Twitter rival Threads. 30 million have joined already  CNN,0.06940246373414993
2023-07-06,"Meta takes aim at Twitter with Threads app, millions join  Reuters",0.025346849113702774
2023-07-06,What is Threads? Here’s what you need to know about the potential ‘Twitter Killer’  CNN,-0.01381317712366581
2023-07-06,Meta launches Threads early as it looks to take on Twitter  CBS News,0.15913839638233185
2023-07-06,Twitter is threatening to sue Meta over Threads  https-//www.semafor.com,-0.9012927412986755
2023-07-07,"We tried Threads, Meta’s new Twitter rival. Here’s what happened  The Guardian",0.0027805082499980927
2023-07-07,Twitter may face difficulties showing Meta stole trade secrets  Reuters,-0.2674688398838043
2023-07-07,Is Meta's Threads threatening Twitter's reign?  Fortune,-0.4488692581653595
2023-07-07,Meta’s Threads upends social media in less than 48 hours  CNN,0.01281481608748436
2023-07-08,Meta’s Threads Is More of the Same Social Networking  The New Yorker,-0.02784542553126812
2023-07-08,An honest review of Meta’s new Threads app—from a loyal Twitter user  Vogue Singapore,0.355874240398407
2023-07-09,Sarah Silverman is suing OpenAI and Meta for copyright infringement  The Verge,-0.6792987585067749
2023-07-10,Meta's 'friendly' Threads collides with unfriendly internet  Reuters,-0.7353813648223877
2023-07-10,Meta's Twitter rival Threads surges to 100 million users faster than ChatGPT  Reuters,0.8704560399055481
2023-07-10,Sarah Silverman sues OpenAI and Meta claiming AI training infringed copyright  The Guardian,-0.8485764265060425
2023-07-10,"Sarah Silverman sues Meta, OpenAI for copyright infringement  Reuters",-0.5925755500793457
2023-07-10,Sarah Silverman Sues OpenAI and Meta Over Copyright Infringement (Published 2023)  The New York Times,-0.18132588267326355
2023-07-10,Meta Ran a Giant Experiment in Governance. Now It’s Turning to AI  WIRED,-0.008624713867902756
2023-07-11,Real-Time Avatar Calls for When You’re Not Camera-Ready and More  Meta Store,-0.0137714184820652
2023-07-11,"As Threads app thrives, experts warn of Meta’s string of privacy violations  The Guardian",-0.5905197262763977
2023-07-11,Announcing our new CBD and related products advertising policy  facebook.com,0.021341785788536072
2023-07-11,Meta exec says ‘the metaverse hype is dead’ and he’s happy: ‘Now we can put our heads down to build’  Fortune,0.16709564626216888
2023-07-11,"Meta laid off staff on disinformation teams responsible for election safety, report says  Business Insider",-0.9604473114013672
2023-07-11,Nick Clegg Is Driving Meta’s Case for Open-Sourced AI  observer.com,0.05961001291871071
2023-07-11,Meta: Court of Justice Confirms That Competition Authorities Can Assess GDPR Compliance In Abuse of Dominance Cases  Cleary Antitrust Watch,0.14617152512073517
2023-07-12,Congressional Report Finds Meta and Tax Prep Companies “Recklessly” Shared Taxpayers’ Data  The Markup,-0.6870347261428833
2023-07-12,Albertsons reinventing digital circulars with Meta pilot  Grocery Dive,0.15661990642547607
2023-07-12,"H&R Block and other tax-prep firms shared consumer data with Meta, lawmakers say  CBS News",-0.04557754099369049
2023-07-12,Meta's Threads wants to become a 'friendly' place by downgrading news and politics  NPR,0.11472555994987488
2023-07-12,Meta’s First Responsible Business Practices Report  Meta Store,0.015963271260261536
2023-07-13,Zuckerberg asked to testify on Meta’s role in human trafficking in Florida  The Guardian,0.03405975550413132
2023-07-14,Valentino to dress Meta avatars in digital fashion  Vogue,0.052395015954971313
2023-07-14,Meta report shows the company causes far more emissions than it can cover with renewable energy  Data Center Dynamics,-0.006280343979597092
2023-07-17,Bringing HDR video to Reels  Engineering at Meta,0.19117087125778198
2023-07-17,"Tailoring microcombs with inverse-designed, meta-dispersion microresonators  Nature",0.04544109106063843
2023-07-17,Norway: Temporarily banning Meta’s invasive advertising is a welcome step for privacy rights  Amnesty International,-0.22060425579547882
2023-07-17,Meta Announces New Video Features for Facebook as It Looks to Align With Broader Usage Trends  Social Media Today,0.8189481496810913
2023-07-18,Meta and Microsoft Introduce the Next Generation of Llama  Meta Store,0.16986709833145142
2023-07-18,"Moving The Monetization Needle, With Meta’s Alvin Bowles  AdExchanger",0.10517635941505432
2023-07-18,How Meta’s Threads Compares with Twitter  GW Today,0.09946992993354797
2023-07-18,"Meta champions open source A.I., but there's a revealing exception in the fine print  Fortune",0.022321728989481926
2023-07-18,Llama copyright drama: Meta stops disclosing what data it uses to train the company's giant AI models  Business Insider,-0.2565912902355194
2023-07-18,Microsoft and Meta expand their AI partnership with Llama 2 on Azure and Windows  The Official Microsoft Blog,0.8668674826622009
2023-07-18,Llama 2 foundation models from Meta are now available in Amazon SageMaker JumpStart  Amazon Web Services,0.05346652865409851
2023-07-18,Meta Unveils a More Powerful A.I. and Isn’t Fretting Over Who Uses It (Published 2023)  The New York Times,0.08048900961875916
2023-07-19,Meta’s Threads: Effects on Competition in Social Media Markets  CSIS | Center for Strategic and International Studies,0.007390949875116348
2023-07-19,Llama 2: why is Meta releasing open-source AI model and are there any risks?  The Guardian,0.00839257799088955
2023-07-19,Meta's new 'open source' Llama 2 AI model isn't so open after all  Business Insider,0.08457707613706589
2023-07-19,Meta Warns Its Latest Large Language Model ‘May Not Be Suitable’ for Non-English Use  Slator,-0.8441473841667175
2023-07-19,Llamas don't drink much water. Meta's new AI version is damn thirsty.  Business Insider,0.0272819846868515
2023-07-19,Could Facebook messages be used in abortion-related prosecution?  The 19th News,-0.12133766710758209
2023-07-19,LLaMA 2: How to access and use Meta's versatile open-source chatbot right now  VentureBeat,0.06789117306470871
2023-07-20,Meta’s Llama 2 Is an Open-Source Rival to ChatGPT  TechRepublic,0.10395628213882446
2023-07-21,Meta faces FTC complaint over blocking of women's sexual health ads  Fierce Pharma,-0.9291268587112427
2023-07-21,"OpenAI, Meta and other tech firms sign onto White House AI commitments  FedScoop",0.12687325477600098
2023-07-21,Dutch online marketplace OLX contributing to EU antitrust probe into Meta  Reuters,-0.9063000679016113
2023-07-23,Are Google and Meta to Blame for the Racist Massacre in Buffalo? (Published 2023)  The New York Times,-0.22682148218154907
2023-07-24,Why is the Meta pixel involved in new data privacy case?  TechHQ,-0.11316753923892975
2023-07-24,Real-time full-color meta fiber endoscopy  Nature,0.021294308826327324
2023-07-24,Meta already appears to hold the rights to 'X.' It could make Twitter's rebrand complicated.  Business Insider,-0.2559639513492584
2023-07-25,"Meta, Microsoft, hundreds more own trademarks to new Twitter name  Reuters",-0.05189378559589386
2023-07-25,"Elon Musk Wants Twitter to Become X, But Meta Already Owns the Trademark  PCMag",0.001871686428785324
2023-07-25,Stop Using Meta Keywords for SEO  JumpFly,-0.08893196284770966
2023-07-26,"Meta’s Threads Isn’t Labeling Propaganda Accounts From Russia, China State Media  The Wall Street Journal",-0.004090549424290657
2023-07-26,Meta’s Open Source Llama Upsets the AI Horse Race  WIRED,-0.3141118884086609
2023-07-26,Facebook's ad rebound gives Meta CEO Mark Zuckerberg freedom to pursue far-out bets  CNBC,0.12651674449443817
2023-07-26,Meta reports better-than-expected results and issues optimistic guidance for third quarter  CNBC,0.8726997375488281
2023-07-26,How Meta’s Oculus Studios Division reduces game development time and costs with Amazon GameLift  Amazon Web Services,-0.039539724588394165
2023-07-26,Alibaba's cloud unit brings Meta's AI model Llama to its clients  Reuters,0.25005683302879333
2023-07-27,Groundbreaking Studies Could Help Answer the Thorniest Questions About Social Media and Democracy  Meta Store,0.3193933963775635
2023-07-27,Does Facebook Polarize Users? Meta Disagrees With Partners Over Research Conclusions  The Wall Street Journal,-0.9301915168762207
2023-07-27,Meta to Charge for Llama 2 After All – If You’re a Hyperscaler  AI Business,0.006709665060043335
2023-07-27,"Meta capex hits $6.4bn on data center, servers, and network spend; costs expected to grow  Data Center Dynamics",0.912499189376831
2023-07-27,Meta Just Proved People Hate Chronological Feeds  WIRED,-0.13463175296783447
2023-07-28,Meta's strategic efficiency and diversification pay off  eMarketer,0.8963914513587952
2023-07-28,"Changing Meta’s algorithms did not help US political polarization, study finds  The Guardian",-0.12467710673809052
2023-07-28,Why Meta is giving away its extremely powerful AI model  Vox,-0.0634155422449112
2023-07-28,Meta’s ad revenue share vastly exceeds its share of consumer time  eMarketer,0.6632421016693115
2023-07-28,Meta plans retention 'hooks' for Threads as more than half of users leave app  Reuters,-0.12805311381816864
2023-07-28,"How Google, Meta and Snap’s battle with TikTok in short-form video is playing out  Digiday",0.007721930742263794
2023-07-30,"'He is in war time': Mark Zuckerberg's desperate, last-ditch attempt to remake himself — and Meta  Business Insider",0.005601081997156143
2023-07-31,Meta prepares chatbots with personas to try to retain users  Financial Times,0.038330208510160446
2023-08-01,WSJ News Exclusive | Meta Offers to Seek Consent for Highly Personalized Ads in Europe  The Wall Street Journal,0.36993056535720825
2023-08-01,Meta to Ask EU Users' Consent to Share Data for Targeted Ads  VOA - Voice of America English News,0.05865781381726265
2023-08-01,Meta Hiring Bain Preceded Layoffs and Zukerberg's 'Efficiency' Push  Business Insider,-0.7844967246055603
2023-08-01,Meta to end news access in Canada over publisher payment law  The Guardian,-0.06556195020675659
2023-08-01,"Meta's Reels revenue narrows in on TikTok, boosted by AI  Reuters",0.9278919696807861
2023-08-01,Meta starts blocking news in Canada over law on paying publishers  Reuters,-0.839857280254364
2023-08-01,Meta begins blocking news access on its platforms in Canada  CNN,-0.8854637145996094
2023-08-01,"Meta developing AI chatbot with personality of Abraham Lincoln, report says  Al Jazeera",0.22072868049144745
2023-08-02,"The Meta Studies: Nuanced Findings, Corporate Spin, and Media Oversimplification  Tech Policy Press",-0.13243192434310913
2023-08-02,Introducing AudioCraft: A Generative AI Tool For Audio and Music  Meta Store,0.08492835611104965
2023-08-02,Meta to ask EU users’ permission to show targeted advertising  The Guardian,0.040443696081638336
2023-08-02,3 big ad stories from Meta’s earnings report: Reels catches up to TikTok  eMarketer,0.14903739094734192
2023-08-02,‘It’s destroyed me completely’: Kenyan moderators decry toll of training of AI models | Artificial intelligence (AI)  The Guardian,-0.043198857456445694
2023-08-02,Meta Begins Blocking News in Canada (Published 2023)  The New York Times,0.02149789407849312
2023-08-03,What Meta’s New Studies Do—and Don’t—Reveal About Social Media and Polarization  WIRED,0.000749317929148674
2023-08-03,"Meta’s Threads still has users one month on, but it doesn’t have a real vibe yet  Digiday",0.044783443212509155
2023-08-03,Norway Took On Meta’s Surveillance Ads and Won  WIRED,0.7894573211669922
2023-08-03,N-heterocyclic carbene- and organic photoredox-catalysed meta -selective acylation of electron-rich arenes  Nature,0.08646706491708755
2023-08-03,WSJ News Exclusive | Meta’s Ray-Ban Smart Glasses Fail to Catch On  The Wall Street Journal,-0.7309940457344055
2023-08-04,‘Disaster’: warning for democracy as experts condemn Meta over Canada news ban  The Guardian,-0.18679368495941162
2023-08-05,Meta’s new shooter game is the most fun I’ve ever had in the metaverse  The Verge,0.2488919049501419
2023-08-07,Using short-lived certificates to protect TLS secrets  Engineering at Meta,0.0258413664996624
2023-08-07,Fixit 2: Meta’s next-generation auto-fixing linter  Engineering at Meta,0.10672147572040558
2023-08-07,Meta Is Reverting To SKAdNetwork 3 Due To A Bug In Apple’s Attribution Tech  AdExchanger,-0.7873274683952332
2023-08-08,Meta Shares New Overview of What You Can Do in Meta Business Suite [Infographic]  Social Media Today,0.10040415823459625
2023-08-08,Creators say Meta is banning them from its creator-focused Facebook group for posting about diminished payouts  Fortune,-0.9154384136199951
2023-08-08,"Canadian companies halt ads on Facebook, Instagram after Meta blocks news access  Reuters",-0.9001815915107727
2023-08-08,Canada publishers urge Ottawa to stop Meta from blocking users’ news access  The Guardian,-0.6036501526832581
2023-08-08,Meta Lays Off Team Behind Revolutionary Protein-folding Model  AI Business,-0.005774218589067459
2023-08-08,How to use Meta Ads for lead generation: A 9-step guide  Search Engine Land,0.0655607357621193
2023-08-08,How Meta is improving password security and preserving privacy  Engineering at Meta,0.16320092976093292
2023-08-09,Meta settles startup's lawsuit over artificial-intelligence trade secrets  Reuters,-0.487747460603714
2023-08-09,Scaling the Instagram Explore recommendations system  Engineering at Meta,0.06090753898024559
2023-08-09,Meta Is Rehiring Some of the Thousands of Workers It Laid Off  Business Insider,-0.960241436958313
